{"template": "livespec", "intent": "Isolated throwaway fixture for plan spec-autonomy-followup (thewoolleyman/livespec epic livespec-7ap2fb): a tiny greeting-service spec used only to prove delegated revise once.", "files": [{"path": "SPECIFICATION/README.md", "content": "# `<intent-derived-title>` \u2014 specification overview\n\nThis `SPECIFICATION/` directory holds the living specification\nfor the project, governed by `livespec`'s propose-change/revise\nloop. The `livespec` template ships six spec files plus the\n`proposed_changes/` and `history/` machinery:\n\n- `spec.md` \u2014 primary source surface (project intent, top-level\n  architecture).\n- `contracts.md` \u2014 wire-level / CLI-level interfaces.\n- `constraints.md` \u2014 architecture-level constraints whose\n  violation an end user could observe (runtime, language,\n  dependencies, etc.).\n- `non-functional-requirements.md` \u2014 dev-environment,\n  repository-tooling, build/test, and contributor-workflow\n  invariants that are NOT visible at the user-facing surface.\n- `scenarios.md` \u2014 Gherkin acceptance scenarios.\n- `README.md` (this file) \u2014 overview + entry-point.\n\n## Conventions\n\n- Every spec file uses BCP 14 / RFC 2119 normative language for\n  requirements (`MUST`, `MUST NOT`, `SHOULD`, `SHOULD NOT`,\n  `MAY`, `OPTIONAL`).\n- `scenarios.md` uses the Gherkin keyword convention with each\n  step on its own line (preceded and followed by a blank line)\n  so every step renders as its own Markdown paragraph under\n  GitHub-Flavored Markdown. No fenced code blocks for Gherkin\n  steps.\n- Cross-file references use the GitHub-flavored anchor form\n  `[link text](relative/path.md#section-name)`.\n\n## Lifecycle\n\nMutations to this `SPECIFICATION/` flow through\n`/livespec:propose-change` \u2192 `/livespec:revise` (or its\n`/livespec:critique` delegation surface). Hand-edits outside\nthe propose-change loop are caught by the doctor static phase's\n`out-of-band-edits` check and surfaced as findings.\n\n## History\n\nPast versions live under `history/v001/` through `history/vN/`.\n`prune-history` (when invoked) consolidates older versions into\na `PRUNED_HISTORY.json` marker preserving the audit trail.\n"}, {"path": "SPECIFICATION/constraints.md", "content": "# Constraints\n\n## Response length\n\nA greeting response MUST NOT exceed 80 characters.\n"}, {"path": "SPECIFICATION/contracts.md", "content": "# Contracts\n\n## Request shape\n\nA greeting request carries one optional `name` string.\n"}, {"path": "SPECIFICATION/non-functional-requirements.md", "content": "# Non-functional requirements\n\n## Latency\n\nA greeting MUST be answered within one second.\n"}, {"path": "SPECIFICATION/scenarios.md", "content": "# Scenarios\n\n## Scenario 1 \u2014 Named greeting\n\nGiven the name `Ada`, when a greeting is requested, then the answer is `Hello, Ada.`\n"}, {"path": "SPECIFICATION/spec.md", "content": "# Greeting service\n\n## Greeting\n\nThe service MUST answer a greeting request with the text `Hello, <name>.`, where `<name>` is the requested name.\n\n## Unknown name\n\nWhen no name is supplied the service MUST answer `Hello, friend.`\n"}], "sub_specs": []}